{
  "id": "c90faa3d-7ac2-48b5-a58a-302e40e653db",
  "slug": "find-the-maximum-divisibility-score",
  "title": "Find the Maximum Divisibility Score",
  "difficulty": "easy",
  "descriptionHtml": "<p>You are given two integer arrays <code>nums</code> and <code>divisors</code>.</p>\n\n<p>The <strong>divisibility score</strong> of <code>divisors[i]</code> is the number of indices <code>j</code> such that <code>nums[j]</code> is divisible by <code>divisors[i]</code>.</p>\n\n<p>Return the integer <code>divisors[i]</code> with the <strong>maximum</strong> divisibility score. If multiple integers have the maximum score, return the smallest one.</p>\n\n<p>&nbsp;</p>\n<p><strong class=\"example\">Example 1:</strong></p>\n\n<div class=\"example-block\">\n<p><strong>Input:</strong> <span class=\"example-io\">nums = [2,9,15,50], divisors = [5,3,7,2]</span></p>\n\n<p><strong>Output:</strong> <span class=\"example-io\">2</span></p>\n\n<p><strong>Explanation:</strong></p>\n\n<p>The divisibility score of <code>divisors[0]</code> is 2 since <code>nums[2]</code> and <code>nums[3]</code> are divisible by 5.</p>\n\n<p>The divisibility score of <code>divisors[1]</code> is 2 since <code>nums[1]</code> and <code>nums[2]</code> are divisible by 3.</p>\n\n<p>The divisibility score of <code>divisors[2]</code> is 0 since none of the numbers in <code>nums</code> is divisible by 7.</p>\n\n<p>The divisibility score of <code>divisors[3]</code> is 2 since <code>nums[0]</code> and <code>nums[3]</code> are divisible by 2.</p>\n\n<p>As <code>divisors[0]</code>,&nbsp;<code>divisors[1]</code>, and <code>divisors[3]</code> have the same divisibility score, we return the smaller one which is <code>divisors[3]</code>.</p>\n</div>\n\n<p><strong class=\"example\">Example 2:</strong></p>\n\n<div class=\"example-block\">\n<p><strong>Input:</strong> <span class=\"example-io\">nums = [4,7,9,3,9], divisors = [5,2,3]</span></p>\n\n<p><strong>Output:</strong> <span class=\"example-io\">3</span></p>\n\n<p><strong>Explanation:</strong></p>\n\n<p>The divisibility score of <code>divisors[0]</code> is 0 since none of numbers in <code>nums</code> is divisible by 5.</p>\n\n<p>The divisibility score of <code>divisors[1]</code> is 1 since only <code>nums[0]</code> is divisible by 2.</p>\n\n<p>The divisibility score of <code>divisors[2]</code> is 3 since <code>nums[2]</code>, <code>nums[3]</code> and <code>nums[4]</code> are divisible by 3.</p>\n</div>\n\n<p><strong class=\"example\">Example 3:</strong></p>\n\n<div class=\"example-block\">\n<p><strong>Input:</strong> <span class=\"example-io\">nums = [20,14,21,10], divisors = [10,16,20]</span></p>\n\n<p><strong>Output:</strong> <span class=\"example-io\">10</span></p>\n\n<p><strong>Explanation:</strong></p>\n\n<p>The divisibility score of <code>divisors[0]</code> is 2 since <code>nums[0]</code> and <code>nums[3]</code> are divisible by 10.</p>\n\n<p>The divisibility score of <code>divisors[1]</code> is 0 since none of the numbers in <code>nums</code> is divisible by 16.</p>\n\n<p>The divisibility score of <code>divisors[2]</code> is 1 since <code>nums[0]</code> is divisible by 20.</p>\n</div>\n\n<p>&nbsp;</p>\n<p><strong>Constraints:</strong></p>\n\n<ul>\n\t<li><code>1 &lt;= nums.length, divisors.length &lt;= 1000</code></li>\n\t<li><code>1 &lt;= nums[i], divisors[i] &lt;= 10<sup>9</sup></code></li>\n</ul>\n",
  "patterns": [
    "array"
  ],
  "constraints": {},
  "examples": [],
  "testCases": [],
  "canonicalSolutions": [
    {
      "language": "cpp",
      "code": "// Time:  O(n * d)\n// Space: O(1)\n\n// brute force\nclass Solution {\npublic:\n    int maxDivScore(vector<int>& nums, vector<int>& divisors) {\n        vector<int> result = {-1, -1};\n        for (const auto& d: divisors) {\n            const int curr = accumulate(cbegin(nums), cend(nums), 0, [&](const auto& total, const auto& x) {\n                return total + static_cast<int>(x % d == 0);\n            });\n            if (curr > result[0] || curr == result[0] && d < result[1]) {\n                result = {curr, d};\n            }\n        }\n        return result[1];\n    }\n};",
      "timeComplexity": "",
      "spaceComplexity": ""
    },
    {
      "language": "python",
      "code": "# Time:  O(n * d)\n# Space: O(1)\n\n# brute force\nclass Solution(object):\n    def maxDivScore(self, nums, divisors):\n        \"\"\"\n        :type nums: List[int]\n        :type divisors: List[int]\n        :rtype: int\n        \"\"\"\n        return max(divisors, key=lambda d: (sum(x%d == 0 for x in nums), -d))",
      "timeComplexity": "",
      "spaceComplexity": ""
    }
  ],
  "editorial": {
    "approach": "",
    "explanation": "",
    "keyInsight": "",
    "commonMistakes": []
  }
}