{
  "id": "651eeb01-f2ab-4556-b764-539b7c8360d3",
  "slug": "beautiful-array",
  "title": "Beautiful Array",
  "difficulty": "medium",
  "descriptionHtml": "<p>An array <code>nums</code> of length <code>n</code> is <strong>beautiful</strong> if:</p>\n\n<ul>\n\t<li><code>nums</code> is a permutation of the integers in the range <code>[1, n]</code>.</li>\n\t<li>For every <code>0 &lt;= i &lt; j &lt; n</code>, there is no index <code>k</code> with <code>i &lt; k &lt; j</code> where <code>2 * nums[k] == nums[i] + nums[j]</code>.</li>\n</ul>\n\n<p>Given the integer <code>n</code>, return <em>any <strong>beautiful</strong> array </em><code>nums</code><em> of length </em><code>n</code>. There will be at least one valid answer for the given <code>n</code>.</p>\n\n<p>&nbsp;</p>\n<p><strong class=\"example\">Example 1:</strong></p>\n<pre><strong>Input:</strong> n = 4\n<strong>Output:</strong> [2,1,4,3]\n</pre><p><strong class=\"example\">Example 2:</strong></p>\n<pre><strong>Input:</strong> n = 5\n<strong>Output:</strong> [3,1,2,5,4]\n</pre>\n<p>&nbsp;</p>\n<p><strong>Constraints:</strong></p>\n\n<ul>\n\t<li><code>1 &lt;= n &lt;= 1000</code></li>\n</ul>\n",
  "patterns": [
    "array",
    "math",
    "divide-and-conquer"
  ],
  "constraints": {},
  "examples": [],
  "testCases": [],
  "canonicalSolutions": [
    {
      "language": "cpp",
      "code": "// Time:  O(n)\n// Space: O(n)\n\nclass Solution {\npublic:\n    vector<int> beautifulArray(int N) {\n        vector<int> result{1};\n        while (result.size() < N) {\n            vector<int> tmp;\n            for (const auto& i : result) {\n                tmp.emplace_back(i * 2 - 1);\n            }\n            for (const auto& i : result) {\n                tmp.emplace_back(i * 2);\n            }\n            result = move(tmp);\n        }\n        vector<int> tmp = move(result);\n        for (const auto& i : tmp) {\n            if (i <= N) {\n                result.emplace_back(i);\n            }\n        }\n        return result;\n    }\n};",
      "timeComplexity": "",
      "spaceComplexity": ""
    },
    {
      "language": "python",
      "code": "# Time:  O(n)\n# Space: O(n)\n\nclass Solution(object):\n    def beautifulArray(self, N):\n        \"\"\"\n        :type N: int\n        :rtype: List[int]\n        \"\"\"\n        result = [1]\n        while len(result) < N:\n            result = [i*2 - 1 for i in result] + [i*2 for i in result]\n        return [i for i in result if i <= N]",
      "timeComplexity": "",
      "spaceComplexity": ""
    }
  ],
  "editorial": {
    "approach": "",
    "explanation": "",
    "keyInsight": "",
    "commonMistakes": []
  }
}