{
  "id": "667281f2-45ea-4aa5-9828-3741d9d976fa",
  "slug": "special-permutations",
  "title": "Special Permutations",
  "difficulty": "medium",
  "descriptionHtml": "<p>You are given a&nbsp;<strong>0-indexed</strong>&nbsp;integer array&nbsp;<code>nums</code>&nbsp;containing&nbsp;<code>n</code>&nbsp;<strong>distinct</strong> positive integers. A permutation of&nbsp;<code>nums</code>&nbsp;is called special if:</p>\n\n<ul>\n\t<li>For all indexes&nbsp;<code>0 &lt;= i &lt; n - 1</code>, either&nbsp;<code>nums[i] % nums[i+1] == 0</code>&nbsp;or&nbsp;<code>nums[i+1] % nums[i] == 0</code>.</li>\n</ul>\n\n<p>Return&nbsp;<em>the total number of special permutations.&nbsp;</em>As the answer could be large, return it&nbsp;<strong>modulo&nbsp;</strong><code>10<sup>9&nbsp;</sup>+ 7</code>.</p>\n\n<p>&nbsp;</p>\n<p><strong class=\"example\">Example 1:</strong></p>\n\n<pre>\n<strong>Input:</strong> nums = [2,3,6]\n<strong>Output:</strong> 2\n<strong>Explanation:</strong> [3,6,2] and [2,6,3] are the two special permutations of nums.\n</pre>\n\n<p><strong class=\"example\">Example 2:</strong></p>\n\n<pre>\n<strong>Input:</strong> nums = [1,4,3]\n<strong>Output:</strong> 2\n<strong>Explanation:</strong> [3,1,4] and [4,1,3] are the two special permutations of nums.\n</pre>\n\n<p>&nbsp;</p>\n<p><strong>Constraints:</strong></p>\n\n<ul>\n\t<li><code>2 &lt;= nums.length &lt;= 14</code></li>\n\t<li><code>1 &lt;= nums[i] &lt;= 10<sup>9</sup></code></li>\n</ul>\n",
  "patterns": [
    "array",
    "dynamic-programming",
    "bit-manipulation",
    "bitmask"
  ],
  "constraints": {},
  "examples": [],
  "testCases": [],
  "canonicalSolutions": [
    {
      "language": "cpp",
      "code": "// Time:  O(n^2 * 2^n)\n// Space: O(n * 2^n)\n\n// backtracking, memoization\nclass Solution {\npublic:\n    int specialPerm(vector<int>& nums) {\n        static const int MOD = 1e9 + 7;\n\n        vector<vector<int>> lookup(size(nums) + 1, vector<int>(1 << size(nums), -1));\n        function<int (int, int)> backtracking = [&](int i, int mask) {\n            if (mask == (1 << size(nums)) - 1) {\n                return 1;\n            }\n            if (lookup[i + 1][mask] == -1) {\n                int total = 0;\n                for (int j = 0; j < size(nums); ++j) {\n                    if (mask & (1 << j)) {\n                        continue;\n                    }\n                    if (!(i == -1 || nums[i] % nums[j] == 0 || nums[j] % nums[i] == 0)) {\n                        continue;\n                    }\n                    total = (total + backtracking(j, mask | (1 << j))) % MOD;\n                }\n                lookup[i + 1][mask] = total;\n            }\n            return lookup[i + 1][mask];\n        };\n\n        return backtracking(-1, 0);\n    }\n};",
      "timeComplexity": "",
      "spaceComplexity": ""
    },
    {
      "language": "python",
      "code": "# Time:  O(n^2 * 2^n)\n# Space: O(n * 2^n)\n\n# backtracking, memoization\nclass Solution(object):\n    def specialPerm(self, nums):\n        \"\"\"\n        :type nums: List[int]\n        :rtype: int\n        \"\"\"\n        MOD = 10**9+7\n        def backtracking(i, mask):\n            if mask == (1<<len(nums))-1:\n                return 1\n            if lookup[i+1][mask] == -1:\n                total = 0\n                for j in xrange(len(nums)):\n                    if mask&(1<<j):\n                        continue\n                    if not (i == -1 or nums[i]%nums[j] == 0 or nums[j]%nums[i] == 0):\n                        continue\n                    total = (total+backtracking(j, mask|(1<<j)))%MOD\n                lookup[i+1][mask] = total\n            return lookup[i+1][mask]\n\n        lookup = [[-1]*(1<<len(nums)) for _ in xrange(len(nums)+1)]\n        return backtracking(-1, 0)",
      "timeComplexity": "",
      "spaceComplexity": ""
    }
  ],
  "editorial": {
    "approach": "",
    "explanation": "",
    "keyInsight": "",
    "commonMistakes": []
  }
}