{
  "id": "f3ac9dd1-302f-4d86-9399-c81029cb6383",
  "slug": "merge-two-binary-trees",
  "title": "Merge Two Binary Trees",
  "difficulty": "easy",
  "descriptionHtml": "<p>You are given two binary trees <code>root1</code> and <code>root2</code>.</p>\n\n<p>Imagine that when you put one of them to cover the other, some nodes of the two trees are overlapped while the others are not. You need to merge the two trees into a new binary tree. The merge rule is that if two nodes overlap, then sum node values up as the new value of the merged node. Otherwise, the NOT null node will be used as the node of the new tree.</p>\n\n<p>Return <em>the merged tree</em>.</p>\n\n<p><strong>Note:</strong> The merging process must start from the root nodes of both trees.</p>\n\n<p>&nbsp;</p>\n<p><strong class=\"example\">Example 1:</strong></p>\n<img alt=\"\" src=\"https://assets.leetcode.com/uploads/2021/02/05/merge.jpg\" style=\"width: 600px; height: 163px;\" />\n<pre>\n<strong>Input:</strong> root1 = [1,3,2,5], root2 = [2,1,3,null,4,null,7]\n<strong>Output:</strong> [3,4,5,5,4,null,7]\n</pre>\n\n<p><strong class=\"example\">Example 2:</strong></p>\n\n<pre>\n<strong>Input:</strong> root1 = [1], root2 = [1,2]\n<strong>Output:</strong> [2,2]\n</pre>\n\n<p>&nbsp;</p>\n<p><strong>Constraints:</strong></p>\n\n<ul>\n\t<li>The number of nodes in both trees is in the range <code>[0, 2000]</code>.</li>\n\t<li><code>-10<sup>4</sup> &lt;= Node.val &lt;= 10<sup>4</sup></code></li>\n</ul>\n",
  "patterns": [
    "tree",
    "depth-first-search",
    "breadth-first-search",
    "binary-tree"
  ],
  "constraints": {},
  "examples": [],
  "testCases": [],
  "canonicalSolutions": [
    {
      "language": "cpp",
      "code": "// Time:  O(n)\n// Space: O(h)\n\n/**\n * Definition for a binary tree node.\n * struct TreeNode {\n *     int val;\n *     TreeNode *left;\n *     TreeNode *right;\n *     TreeNode(int x) : val(x), left(NULL), right(NULL) {}\n * };\n */\nclass Solution {\npublic:\n    TreeNode* mergeTrees(TreeNode* t1, TreeNode* t2) {\n        if (!t1) {\n            return t2;\n        }\n        if (!t2) {\n            return t1;\n        }\n        t1->val += t2->val;\n        t1->left = mergeTrees(t1->left, t2->left);\n        t1->right = mergeTrees(t1->right, t2->right);\n        return t1;\n    }\n};",
      "timeComplexity": "",
      "spaceComplexity": ""
    },
    {
      "language": "python",
      "code": "# Time:  O(n)\n# Space: O(h)\n\nclass Solution(object):\n    def mergeTrees(self, t1, t2):\n        \"\"\"\n        :type t1: TreeNode\n        :type t2: TreeNode\n        :rtype: TreeNode\n        \"\"\"\n        if t1 is None:\n            return t2\n        if t2 is None:\n            return t1\n        t1.val += t2.val\n        t1.left = self.mergeTrees(t1.left, t2.left)\n        t1.right = self.mergeTrees(t1.right, t2.right)\n        return t1",
      "timeComplexity": "",
      "spaceComplexity": ""
    }
  ],
  "editorial": {
    "approach": "",
    "explanation": "",
    "keyInsight": "",
    "commonMistakes": []
  }
}