{
  "id": "30a8fdfa-af7e-4959-90e6-05d881dc11c5",
  "slug": "minimum-number-of-operations-to-make-elements-in-array-distinct",
  "title": "Minimum Number of Operations to Make Elements in Array Distinct",
  "difficulty": "easy",
  "descriptionHtml": "<p>You are given an integer array <code>nums</code>. You need to ensure that the elements in the array are <strong>distinct</strong>. To achieve this, you can perform the following operation any number of times:</p>\n\n<ul>\n\t<li>Remove 3 elements from the beginning of the array. If the array has fewer than 3 elements, remove all remaining elements.</li>\n</ul>\n\n<p><strong>Note</strong> that an empty array is considered to have distinct elements. Return the <strong>minimum</strong> number of operations needed to make the elements in the array distinct.<!-- notionvc: 210ee4f2-90af-4cdf-8dbc-96d1fa8f67c7 --></p>\n\n<p>&nbsp;</p>\n<p><strong class=\"example\">Example 1:</strong></p>\n\n<div class=\"example-block\">\n<p><strong>Input:</strong> <span class=\"example-io\">nums = [1,2,3,4,2,3,3,5,7]</span></p>\n\n<p><strong>Output:</strong> <span class=\"example-io\">2</span></p>\n\n<p><strong>Explanation:</strong></p>\n\n<ul>\n\t<li>In the first operation, the first 3 elements are removed, resulting in the array <code>[4, 2, 3, 3, 5, 7]</code>.</li>\n\t<li>In the second operation, the next 3 elements are removed, resulting in the array <code>[3, 5, 7]</code>, which has distinct elements.</li>\n</ul>\n\n<p>Therefore, the answer is 2.</p>\n</div>\n\n<p><strong class=\"example\">Example 2:</strong></p>\n\n<div class=\"example-block\">\n<p><strong>Input:</strong> <span class=\"example-io\">nums = [4,5,6,4,4]</span></p>\n\n<p><strong>Output:</strong> 2</p>\n\n<p><strong>Explanation:</strong></p>\n\n<ul>\n\t<li>In the first operation, the first 3 elements are removed, resulting in the array <code>[4, 4]</code>.</li>\n\t<li>In the second operation, all remaining elements are removed, resulting in an empty array.</li>\n</ul>\n\n<p>Therefore, the answer is 2.</p>\n</div>\n\n<p><strong class=\"example\">Example 3:</strong></p>\n\n<div class=\"example-block\">\n<p><strong>Input:</strong> <span class=\"example-io\">nums = [6,7,8,9]</span></p>\n\n<p><strong>Output:</strong> <span class=\"example-io\">0</span></p>\n\n<p><strong>Explanation:</strong></p>\n\n<p>The array already contains distinct elements. Therefore, the answer is 0.</p>\n</div>\n\n<p>&nbsp;</p>\n<p><strong>Constraints:</strong></p>\n\n<ul>\n\t<li><code>1 &lt;= nums.length &lt;= 100</code></li>\n\t<li><code>1 &lt;= nums[i] &lt;= 100</code></li>\n</ul>\n",
  "patterns": [
    "array",
    "hash-table"
  ],
  "constraints": {},
  "examples": [],
  "testCases": [],
  "canonicalSolutions": [
    {
      "language": "cpp",
      "code": "// Time:  O(n + r)\n// Space: O(r)\n\n// freq table\nclass Solution {\npublic:\n    int minimumOperations(vector<int>& nums) {\n        const auto& ceil_divide = [](int a, int b) {\n            return (a + b - 1) / b;\n        };\n\n        const int mx = ranges::max(nums);\n        vector<int> cnt(mx);\n        for (int i = size(nums) - 1; i >= 0; --i) {\n            if (++cnt[nums[i] - 1] == 2) {\n                return ceil_divide(i + 1, 3);\n            }\n        }\n        return 0;\n    }\n};",
      "timeComplexity": "",
      "spaceComplexity": ""
    },
    {
      "language": "python",
      "code": "# Time:  O(n + r)\n# Space: O(r)\n\n# freq table\nclass Solution(object):\n    def minimumOperations(self, nums):\n        \"\"\"\n        :type nums: List[int]\n        :rtype: int\n        \"\"\"\n        def ceil_divide(a, b):\n            return (a+b-1)//b\n\n        mx = max(nums)\n        cnt = [0]*mx\n        for i in reversed(xrange(len(nums))):\n            cnt[nums[i]-1] += 1\n            if cnt[nums[i]-1] == 2:\n                return ceil_divide(i+1, 3)\n        return 0",
      "timeComplexity": "",
      "spaceComplexity": ""
    }
  ],
  "editorial": {
    "approach": "",
    "explanation": "",
    "keyInsight": "",
    "commonMistakes": []
  }
}