{
  "id": "d147ae94-bb4a-4c88-b9f1-8be7d20cf4b7",
  "slug": "poor-pigs",
  "title": "Poor Pigs",
  "difficulty": "hard",
  "descriptionHtml": "<p>There are <code>buckets</code> buckets of liquid, where <strong>exactly one</strong> of the buckets is poisonous. To figure out which one is poisonous, you feed some number of (poor) pigs the liquid to see whether they will die or not. Unfortunately, you only have <code>minutesToTest</code> minutes to determine which bucket is poisonous.</p>\n\n<p>You can feed the pigs according to these steps:</p>\n\n<ol>\n\t<li>Choose some live pigs to feed.</li>\n\t<li>For each pig, choose which buckets to feed it. The pig will consume all the chosen buckets simultaneously and will take no time. Each pig can feed from any number of buckets, and each bucket can be fed from by any number of pigs.</li>\n\t<li>Wait for <code>minutesToDie</code> minutes. You may <strong>not</strong> feed any other pigs during this time.</li>\n\t<li>After <code>minutesToDie</code> minutes have passed, any pigs that have been fed the poisonous bucket will die, and all others will survive.</li>\n\t<li>Repeat this process until you run out of time.</li>\n</ol>\n\n<p>Given <code>buckets</code>, <code>minutesToDie</code>, and <code>minutesToTest</code>, return <em>the <strong>minimum</strong> number of pigs needed to figure out which bucket is poisonous within the allotted time</em>.</p>\n\n<p>&nbsp;</p>\n<p><strong class=\"example\">Example 1:</strong></p>\n\n<pre>\n<strong>Input:</strong> buckets = 4, minutesToDie = 15, minutesToTest = 15\n<strong>Output:</strong> 2\n<strong>Explanation:</strong> We can determine the poisonous bucket as follows:\nAt time 0, feed the first pig buckets 1 and 2, and feed the second pig buckets 2 and 3.\nAt time 15, there are 4 possible outcomes:\n- If only the first pig dies, then bucket 1 must be poisonous.\n- If only the second pig dies, then bucket 3 must be poisonous.\n- If both pigs die, then bucket 2 must be poisonous.\n- If neither pig dies, then bucket 4 must be poisonous.\n</pre>\n\n<p><strong class=\"example\">Example 2:</strong></p>\n\n<pre>\n<strong>Input:</strong> buckets = 4, minutesToDie = 15, minutesToTest = 30\n<strong>Output:</strong> 2\n<strong>Explanation:</strong> We can determine the poisonous bucket as follows:\nAt time 0, feed the first pig bucket 1, and feed the second pig bucket 2.\nAt time 15, there are 2 possible outcomes:\n- If either pig dies, then the poisonous bucket is the one it was fed.\n- If neither pig dies, then feed the first pig bucket 3, and feed the second pig bucket 4.\nAt time 30, one of the two pigs must die, and the poisonous bucket is the one it was fed.\n</pre>\n\n<p>&nbsp;</p>\n<p><strong>Constraints:</strong></p>\n\n<ul>\n\t<li><code>1 &lt;= buckets &lt;= 1000</code></li>\n\t<li><code>1 &lt;=&nbsp;minutesToDie &lt;=&nbsp;minutesToTest &lt;= 100</code></li>\n</ul>\n",
  "patterns": [
    "math",
    "dynamic-programming",
    "combinatorics"
  ],
  "constraints": {},
  "examples": [],
  "testCases": [
    {
      "input": "4\n15\n15\n4\n15\n30",
      "expectedOutput": "",
      "isHidden": false
    }
  ],
  "canonicalSolutions": [
    {
      "language": "cpp",
      "code": "// Time:  O(1)\n// Space: O(1)\n\nclass Solution {\npublic:\n    int poorPigs(int buckets, int minutesToDie, int minutesToTest) {\n        return ceil(log(buckets) / log(minutesToTest / minutesToDie + 1));\n    }\n};",
      "timeComplexity": "",
      "spaceComplexity": ""
    },
    {
      "language": "python",
      "code": "# Time:  O(1)\n# Space: O(1)\n\nimport math\n\n\nclass Solution(object):\n    def poorPigs(self, buckets, minutesToDie, minutesToTest):\n        \"\"\"\n        :type buckets: int\n        :type minutesToDie: int\n        :type minutesToTest: int\n        :rtype: int\n        \"\"\"\n        return int(math.ceil(math.log(buckets) / math.log(minutesToTest / minutesToDie + 1)))",
      "timeComplexity": "",
      "spaceComplexity": ""
    }
  ],
  "editorial": {
    "approach": "",
    "explanation": "",
    "keyInsight": "",
    "commonMistakes": []
  }
}