{
  "id": "a0455922-ef31-4c1f-9d75-9fb60554d3f2",
  "slug": "reducing-dishes",
  "title": "Reducing Dishes",
  "difficulty": "hard",
  "descriptionHtml": "<p>A chef has collected data on the <code>satisfaction</code> level of his <code>n</code> dishes. Chef can cook any dish in 1 unit of time.</p>\n\n<p><strong>Like-time coefficient</strong> of a dish is defined as the time taken to cook that dish including previous dishes multiplied by its satisfaction level i.e. <code>time[i] * satisfaction[i]</code>.</p>\n\n<p>Return the maximum sum of <strong>like-time coefficient </strong>that the chef can obtain after preparing some amount of dishes.</p>\n\n<p>Dishes can be prepared in <strong>any </strong>order and the chef can discard some dishes to get this maximum value.</p>\n\n<p>&nbsp;</p>\n<p><strong class=\"example\">Example 1:</strong></p>\n\n<pre>\n<strong>Input:</strong> satisfaction = [-1,-8,0,5,-9]\n<strong>Output:</strong> 14\n<strong>Explanation:</strong> After Removing the second and last dish, the maximum total <strong>like-time coefficient</strong> will be equal to (-1*1 + 0*2 + 5*3 = 14).\nEach dish is prepared in one unit of time.</pre>\n\n<p><strong class=\"example\">Example 2:</strong></p>\n\n<pre>\n<strong>Input:</strong> satisfaction = [4,3,2]\n<strong>Output:</strong> 20\n<strong>Explanation:</strong> Dishes can be prepared in any order, (2*1 + 3*2 + 4*3 = 20)\n</pre>\n\n<p><strong class=\"example\">Example 3:</strong></p>\n\n<pre>\n<strong>Input:</strong> satisfaction = [-1,-4,-5]\n<strong>Output:</strong> 0\n<strong>Explanation:</strong> People do not like the dishes. No dish is prepared.\n</pre>\n\n<p>&nbsp;</p>\n<p><strong>Constraints:</strong></p>\n\n<ul>\n\t<li><code>n == satisfaction.length</code></li>\n\t<li><code>1 &lt;= n &lt;= 500</code></li>\n\t<li><code>-1000 &lt;= satisfaction[i] &lt;= 1000</code></li>\n</ul>\n",
  "patterns": [
    "array",
    "dynamic-programming",
    "greedy",
    "sorting"
  ],
  "constraints": {},
  "examples": [],
  "testCases": [],
  "canonicalSolutions": [
    {
      "language": "cpp",
      "code": "// Time:  O(nlogn)\n// Space: O(1)\n\nclass Solution {\npublic:\n    int maxSatisfaction(vector<int>& satisfaction) {\n        sort(begin(satisfaction), end(satisfaction), greater<int>());\n        int result = 0;\n        for (int i = 0, curr = 0; i < satisfaction.size() && curr + satisfaction[i] > 0; ++i) {\n            curr += satisfaction[i];\n            result += curr;\n        }\n        return result;\n    }\n};",
      "timeComplexity": "",
      "spaceComplexity": ""
    },
    {
      "language": "python",
      "code": "# Time:  O(nlogn)\n# Space: O(1)\n\nclass Solution(object):\n    def maxSatisfaction(self, satisfaction):\n        \"\"\"\n        :type satisfaction: List[int]\n        :rtype: int\n        \"\"\"\n        satisfaction.sort(reverse=True)\n        result, curr = 0, 0\n        for x in satisfaction:\n            curr += x\n            if curr <= 0:\n                break\n            result += curr\n        return result",
      "timeComplexity": "",
      "spaceComplexity": ""
    }
  ],
  "editorial": {
    "approach": "",
    "explanation": "",
    "keyInsight": "",
    "commonMistakes": []
  }
}