{
  "id": "f74b4018-e190-498b-ae61-37f25133e636",
  "slug": "arranging-coins",
  "title": "Arranging Coins",
  "difficulty": "easy",
  "descriptionHtml": "<p>You have <code>n</code> coins and you want to build a staircase with these coins. The staircase consists of <code>k</code> rows where the <code>i<sup>th</sup></code> row has exactly <code>i</code> coins. The last row of the staircase <strong>may be</strong> incomplete.</p>\n\n<p>Given the integer <code>n</code>, return <em>the number of <strong>complete rows</strong> of the staircase you will build</em>.</p>\n\n<p>&nbsp;</p>\n<p><strong class=\"example\">Example 1:</strong></p>\n<img alt=\"\" src=\"https://assets.leetcode.com/uploads/2021/04/09/arrangecoins1-grid.jpg\" style=\"width: 253px; height: 253px;\" />\n<pre>\n<strong>Input:</strong> n = 5\n<strong>Output:</strong> 2\n<strong>Explanation:</strong> Because the 3<sup>rd</sup> row is incomplete, we return 2.\n</pre>\n\n<p><strong class=\"example\">Example 2:</strong></p>\n<img alt=\"\" src=\"https://assets.leetcode.com/uploads/2021/04/09/arrangecoins2-grid.jpg\" style=\"width: 333px; height: 333px;\" />\n<pre>\n<strong>Input:</strong> n = 8\n<strong>Output:</strong> 3\n<strong>Explanation:</strong> Because the 4<sup>th</sup> row is incomplete, we return 3.\n</pre>\n\n<p>&nbsp;</p>\n<p><strong>Constraints:</strong></p>\n\n<ul>\n\t<li><code>1 &lt;= n &lt;= 2<sup>31</sup> - 1</code></li>\n</ul>\n",
  "patterns": [
    "math",
    "binary-search"
  ],
  "constraints": {},
  "examples": [],
  "testCases": [],
  "canonicalSolutions": [
    {
      "language": "cpp",
      "code": "// Time:  O(logn)\n// Space: O(1)\n\nclass Solution {\npublic:\n    int arrangeCoins(int n) {\n        return static_cast<int>((sqrt(8.0 * n + 1) - 1) / 2);\n    }\n};\n\n// Time:  O(logn)\n// Space: O(1)\nclass Solution2 {\npublic:\n    int arrangeCoins(int n) {\n        uint64_t left = 1, right = n;\n        while (left <= right) {\n            const auto mid = left + (right - left) / 2;\n            if (!check(mid, n)) {\n                right = mid - 1;\n            } else {\n                left = mid + 1;\n            }\n        }\n        return right;\n    }\n\nprivate:\n    bool check(uint64_t mid, uint64_t n) {\n        return mid <= 2L * n / (mid + 1);\n    }\n};",
      "timeComplexity": "",
      "spaceComplexity": ""
    },
    {
      "language": "python",
      "code": "# Time:  O(logn)\n# Space: O(1)\n\nimport math\n\n\nclass Solution(object):\n    def arrangeCoins(self, n):\n        \"\"\"\n        :type n: int\n        :rtype: int\n        \"\"\"\n        return int((math.sqrt(8*n+1)-1) / 2)  # sqrt is O(logn) time.\n\n\n# Time:  O(logn)\n# Space: O(1)\nclass Solution2(object):\n    def arrangeCoins(self, n):\n        \"\"\"\n        :type n: int\n        :rtype: int\n        \"\"\"\n        def check(mid, n):\n            return mid*(mid+1) <= 2*n\n\n        left, right = 1, n\n        while left <= right:\n            mid = left + (right-left)//2\n            if not check(mid, n):\n                right = mid-1\n            else:\n                left = mid+1\n        return right",
      "timeComplexity": "",
      "spaceComplexity": ""
    }
  ],
  "editorial": {
    "approach": "",
    "explanation": "",
    "keyInsight": "",
    "commonMistakes": []
  }
}