{
  "id": "592c31dc-1f46-47b6-acff-44831279915d",
  "slug": "minimum-number-of-days-to-eat-n-oranges",
  "title": "Minimum Number of Days to Eat N Oranges",
  "difficulty": "hard",
  "descriptionHtml": "<p>There are <code>n</code> oranges in the kitchen and you decided to eat some of these oranges every day as follows:</p>\n\n<ul>\n\t<li>Eat one orange.</li>\n\t<li>If the number of remaining oranges <code>n</code> is divisible by <code>2</code> then you can eat <code>n / 2</code> oranges.</li>\n\t<li>If the number of remaining oranges <code>n</code> is divisible by <code>3</code> then you can eat <code>2 * (n / 3)</code> oranges.</li>\n</ul>\n\n<p>You can only choose one of the actions per day.</p>\n\n<p>Given the integer <code>n</code>, return <em>the minimum number of days to eat</em> <code>n</code> <em>oranges</em>.</p>\n\n<p>&nbsp;</p>\n<p><strong class=\"example\">Example 1:</strong></p>\n\n<pre>\n<strong>Input:</strong> n = 10\n<strong>Output:</strong> 4\n<strong>Explanation:</strong> You have 10 oranges.\nDay 1: Eat 1 orange,  10 - 1 = 9.  \nDay 2: Eat 6 oranges, 9 - 2*(9/3) = 9 - 6 = 3. (Since 9 is divisible by 3)\nDay 3: Eat 2 oranges, 3 - 2*(3/3) = 3 - 2 = 1. \nDay 4: Eat the last orange  1 - 1  = 0.\nYou need at least 4 days to eat the 10 oranges.\n</pre>\n\n<p><strong class=\"example\">Example 2:</strong></p>\n\n<pre>\n<strong>Input:</strong> n = 6\n<strong>Output:</strong> 3\n<strong>Explanation:</strong> You have 6 oranges.\nDay 1: Eat 3 oranges, 6 - 6/2 = 6 - 3 = 3. (Since 6 is divisible by 2).\nDay 2: Eat 2 oranges, 3 - 2*(3/3) = 3 - 2 = 1. (Since 3 is divisible by 3)\nDay 3: Eat the last orange  1 - 1  = 0.\nYou need at least 3 days to eat the 6 oranges.\n</pre>\n\n<p>&nbsp;</p>\n<p><strong>Constraints:</strong></p>\n\n<ul>\n\t<li><code>1 &lt;= n &lt;= 2 * 10<sup>9</sup></code></li>\n</ul>\n",
  "patterns": [
    "dynamic-programming",
    "memoization"
  ],
  "constraints": {},
  "examples": [],
  "testCases": [],
  "canonicalSolutions": [
    {
      "language": "cpp",
      "code": "// Time:  O((logn)^2)\n// Space: O((logn)^2)\n\n// complexity analysis: see https://leetcode.com/problems/minimum-number-of-days-to-eat-n-oranges/discuss/794847/Polylogarithmic-solution\nclass Solution {\npublic:\n    int minDays(int n) {\n        unordered_map<int, int> lookup;\n        return memoization(n, &lookup);\n    }\n\nprivate:\n    int memoization(int i, unordered_map<int, int> *lookup) {\n        if (i <= 1) {\n            return i;\n        }\n        if (!lookup->count(i)) {\n            (*lookup)[i] = 1 + min(i % 2 + memoization(i / 2, lookup),\n                                   i % 3 + memoization(i / 3, lookup));\n        }\n        return (*lookup)[i];\n    }\n};\n\n// Time:  O((logn)^2)\n// Space: O((logn)^2)\nclass Solution2 {\npublic:\n    int minDays(int n) {\n        int result = 0;\n        vector<int> q = {n};\n        unordered_set<int> lookup = {n};\n        while (!q.empty()) {\n            vector<int> new_q;\n            for (const auto& i : q) {\n                if (i == 0) {\n                    return result;\n                }\n                if (!lookup.count(i - 1)) {\n                    lookup.emplace(i - 1);\n                    new_q.emplace_back(i - 1);\n                }\n                if (i % 2 == 0 && !lookup.count(i / 2)) {\n                    lookup.emplace(i / 2);\n                    new_q.emplace_back(i / 2);\n                }\n                if (i % 3 == 0 && !lookup.count(i / 3)) {\n                    lookup.emplace(i / 3);\n                    new_q.emplace_back(i / 3);\n                }\n            }\n            ++result;\n            q = move(new_q);\n        }\n        return result;\n    }\n};",
      "timeComplexity": "",
      "spaceComplexity": ""
    },
    {
      "language": "python",
      "code": "# Time:  O((logn)^2)\n# Space: O((logn)^2)\n\n# complexity analysis: see https://leetcode.com/problems/minimum-number-of-days-to-eat-n-oranges/discuss/794847/Polylogarithmic-solution\nclass Solution(object):\n    def minDays(self, n):\n        \"\"\"\n        :type n: int\n        :rtype: int\n        \"\"\"\n        def memoization(lookup, i):\n            if i <= 1:\n                return i\n            if i not in lookup:\n                lookup[i] = 1+min(i%2+memoization(lookup, i//2),\n                                  i%3+memoization(lookup, i//3))\n            return lookup[i]\n\n        lookup = {}\n        return memoization(lookup, n)\n\n\n# Time:  O((logn)^2)\n# Space: O((logn)^2)\nclass Solution2(object):\n    def minDays(self, n):\n        result = 0\n        q, lookup = [n], set([n])\n        while q:\n            new_q = []\n            for i in q: \n                if not i:\n                    return result\n                if i-1 not in lookup:\n                    lookup.add(i-1)\n                    new_q.append(i-1)\n                if i%2 == 0 and i//2 not in lookup:\n                    lookup.add(i//2)\n                    new_q.append(i//2)\n                if i%3 == 0 and i//3 not in lookup:\n                    lookup.add(i//3)\n                    new_q.append(i//3)\n            result += 1\n            q = new_q\n        return result",
      "timeComplexity": "",
      "spaceComplexity": ""
    }
  ],
  "editorial": {
    "approach": "",
    "explanation": "",
    "keyInsight": "",
    "commonMistakes": []
  }
}