{
  "id": "d1f1ba9b-8777-4750-a25a-b7734d0a7640",
  "slug": "number-of-people-that-can-be-seen-in-a-grid",
  "title": "Number of People That Can Be Seen in a Grid",
  "difficulty": "medium",
  "descriptionHtml": "",
  "patterns": [
    "array",
    "stack",
    "matrix",
    "monotonic-stack"
  ],
  "constraints": {},
  "examples": [],
  "testCases": [],
  "canonicalSolutions": [
    {
      "language": "cpp",
      "code": "// Time:  O(m * n)\n// Space: O(m + n)\n\n// mono stack, optimized from solution2\nclass Solution {\npublic:\n    vector<vector<int>> seePeople(vector<vector<int>>& heights) {\n        vector<vector<int>> result(size(heights), vector<int>(size(heights[0])));\n        const auto& count = [](int h, vector<int> *stk) {\n            int cnt = 0;\n            while (!empty(*stk) && stk->back() < h) {\n                stk->pop_back();\n                ++cnt;\n            }\n            if (!empty(*stk)) {\n                ++cnt;\n            }\n            if (empty(*stk) || stk->back() != h) {\n                stk->emplace_back(h);\n            }\n            return cnt;\n        };\n\n        for (int i = 0; i < size(heights); ++i) {\n            vector<int> stk;\n            for (int j = size(heights[0]) - 1; j >= 0; --j) {\n                result[i][j] += count(heights[i][j], &stk);\n            }\n        }\n        for (int j = 0; j < size(heights[0]); ++j) {\n            vector<int> stk;\n            for (int i = size(heights) - 1; i >= 0; --i) {\n                result[i][j] += count(heights[i][j], &stk);\n            }\n        }\n        return result;\n    }\n};\n\n// Time:  O(m * n)\n// Space: O(m + n)\n// mono stack\nclass Solution2 {\npublic:\n    vector<vector<int>> seePeople(vector<vector<int>>& heights) {\n        vector<vector<int>> result(size(heights), vector<int>(size(heights[0])));\n        const auto& count = [](const auto& height, int i, vector<int> *stk) {\n            int cnt = 0;\n            while (!empty(*stk) && height(stk->back()) < height(i)) {\n                stk->pop_back();\n                ++cnt;\n            }\n            if (!empty(*stk)) {\n                ++cnt;\n            }\n            if (!empty(*stk) && height(stk->back()) == height(i)) {\n                stk->pop_back();\n            }\n            stk->emplace_back(i);\n            return cnt;\n        };\n\n        for (int i = 0; i < size(heights); ++i) {\n            const auto& height = [&](int x) {\n                return heights[i][x];\n            };\n            vector<int> stk;\n            for (int j = size(heights[0]) - 1; j >= 0; --j) {\n                result[i][j] += count(height, j, &stk);\n            }\n        }\n        for (int j = 0; j < size(heights[0]); ++j) {\n            const auto& height = [&](int x) {\n                return heights[x][j];\n            };\n            vector<int> stk;\n            for (int i = size(heights) - 1; i >= 0; --i) {\n                result[i][j] += count(height, i, &stk);\n            }\n        }\n        return result;\n    }\n};\n\n// Time:  O(m * n)\n// Space: O(m + n)\n// mono stack\nclass Solution3 {\npublic:\n    vector<vector<int>> seePeople(vector<vector<int>>& heights) {\n        vector<vector<int>> result(size(heights), vector<int>(size(heights[0])));\n        const auto& count = [](const auto& height, int i, vector<int> *stk, const auto& increase) {\n            while (!empty(*stk) && height(stk->back()) < height(i)) {\n                increase(stk->back()); stk->pop_back();\n            }\n            if (!empty(*stk)) {\n                increase(stk->back());\n            }\n            if (!empty(*stk) && height(stk->back()) == height(i)) {\n                stk->pop_back();\n            }\n            stk->emplace_back(i);\n        };\n\n        for (int i = 0; i < size(heights); ++i) {\n            const auto& height = [&](int x) {\n                return heights[i][x];\n            };\n            const auto& increase = [&](int x) {\n                ++result[i][x];\n            };\n            vector<int> stk;\n            for (int j = 0; j < size(heights[0]); ++j) {\n                count(height, j, &stk, increase);\n            }\n        }\n        for (int j = 0; j < size(heights[0]); ++j) {\n            const auto& height = [&](int x) {\n                return heights[x][j];\n            };\n            const auto& increase = [&](int x) {\n                ++result[x][j];\n            };\n            vector<int> stk;\n            for (int i = 0; i < size(heights); ++i) {\n                count(height, i, &stk, increase);\n            }\n        }\n        return result;\n    }\n};",
      "timeComplexity": "",
      "spaceComplexity": ""
    },
    {
      "language": "python",
      "code": "# Time:  O(m * n)\n# Space: O(m + n)\n\n# mono stack, optimized from solution2\nclass Solution(object):\n    def seePeople(self, heights):\n        \"\"\"\n        :type heights: List[List[int]]\n        :rtype: List[List[int]]\n        \"\"\"\n        def count(h, stk):\n            cnt = 0\n            while stk and stk[-1] < h:\n                stk.pop()\n                cnt += 1\n            if stk:\n                cnt += 1\n            if not stk or stk[-1] != h:\n                stk.append(h)\n            return cnt\n            \n        result = [[0]*len(heights[0]) for _ in xrange(len(heights))]\n        for i in xrange(len(heights)):\n            stk = []\n            for j in reversed(xrange(len(heights[0]))):\n                result[i][j] += count(heights[i][j], stk)     \n        for j in xrange(len(heights[0])):\n            stk = []\n            for i in reversed(xrange(len(heights))):\n                result[i][j] += count(heights[i][j], stk)             \n        return result\n\n\n# Time:  O(m * n)\n# Space: O(m + n)\n# mono stack\nclass Solution2(object):\n    def seePeople(self, heights):\n        \"\"\"\n        :type heights: List[List[int]]\n        :rtype: List[List[int]]\n        \"\"\"\n        def count(heights, i, stk):\n            cnt = 0\n            while stk and heights(stk[-1]) < heights(i):\n                stk.pop()\n                cnt += 1\n            if stk:\n                cnt += 1\n            if stk and heights(stk[-1]) == heights(i):\n                stk.pop()\n            stk.append(i)\n            return cnt\n            \n        result = [[0]*len(heights[0]) for _ in xrange(len(heights))]\n        for i in xrange(len(heights)):\n            stk = []\n            for j in reversed(xrange(len(heights[0]))):\n                result[i][j] += count(lambda x: heights[i][x], j, stk)     \n        for j in xrange(len(heights[0])):\n            stk = []\n            for i in reversed(xrange(len(heights))):\n                result[i][j] += count(lambda x: heights[x][j], i, stk)             \n        return result\n\n\n# Time:  O(m * n)\n# Space: O(m + n)\n# mono stack\nclass Solution3(object):\n    def seePeople(self, heights):\n        \"\"\"\n        :type heights: List[List[int]]\n        :rtype: List[List[int]]\n        \"\"\"\n        def count(heights, i, stk, add):\n            while stk and heights(stk[-1]) < heights(i):\n                increase(stk.pop())\n            if stk:\n                increase(stk[-1])\n            if stk and heights(stk[-1]) == heights(i):\n                stk.pop()\n            stk.append(i)\n            \n        result = [[0]*len(heights[0]) for _ in xrange(len(heights))]\n        for i in xrange(len(heights)):\n            stk = []\n            def increase(x): result[i][x] += 1\n            for j in xrange(len(heights[0])):\n                count(lambda x: heights[i][x], j, stk, add)\n        for j in xrange(len(heights[0])):\n            stk = []\n            def increase(x): result[x][j] += 1\n            for i in xrange(len(heights)):\n                count(lambda x: heights[x][j], i, stk, add)\n        return result",
      "timeComplexity": "",
      "spaceComplexity": ""
    }
  ],
  "editorial": {
    "approach": "",
    "explanation": "",
    "keyInsight": "",
    "commonMistakes": []
  }
}