{
  "id": "284f5f4d-765f-476f-ba16-e7db3eb565f8",
  "slug": "display-the-first-three-rows",
  "title": "Display the First Three Rows",
  "difficulty": "easy",
  "descriptionHtml": "<pre>\nDataFrame: <code>employees</code>\n+-------------+--------+\n| Column Name | Type   |\n+-------------+--------+\n| employee_id | int    |\n| name        | object |\n| department  | object |\n| salary      | int    |\n+-------------+--------+\n</pre>\n\n<p>Write a solution to display the <strong>first <code>3</code> </strong>rows<strong> </strong>of this DataFrame.</p>\n\n<p>&nbsp;</p>\n<p><strong class=\"example\">Example 1:</strong></p>\n\n<pre>\n<strong>Input:\n</strong>DataFrame employees\n+-------------+-----------+-----------------------+--------+\n| employee_id | name      | department            | salary |\n+-------------+-----------+-----------------------+--------+\n| 3           | Bob       | Operations            | 48675  |\n| 90          | Alice     | Sales                 | 11096  |\n| 9           | Tatiana   | Engineering           | 33805  |\n| 60          | Annabelle | InformationTechnology | 37678  |\n| 49          | Jonathan  | HumanResources        | 23793  |\n| 43          | Khaled    | Administration        | 40454  |\n+-------------+-----------+-----------------------+--------+\n<strong>Output:</strong>\n+-------------+---------+-------------+--------+\n| employee_id | name    | department  | salary |\n+-------------+---------+-------------+--------+\n| 3           | Bob     | Operations  | 48675  |\n| 90          | Alice   | Sales       | 11096  |\n| 9           | Tatiana | Engineering | 33805  |\n+-------------+---------+-------------+--------+\n<strong>Explanation:</strong> \nOnly the first 3 rows are displayed.</pre>\n",
  "patterns": [],
  "constraints": {},
  "examples": [],
  "testCases": [
    {
      "input": "{\"headers\":{\"employees\":[\"employee_id\",\"name\",\"department\",\"salary\"]},\"rows\":{\"employees\":[[3,\"Bob\",\"Operations\",48675],[90,\"Alice\",\"Sales\",11096],[9,\"Tatiana\",\"Engineering\",33805],[60,\"Annabelle\",\"InformationTechnology\",37678],[49,\"Jonathan\",\"HumanResources\",23793],[43,\"Khaled\",\"Administration\",40454]]}}",
      "expectedOutput": "",
      "isHidden": false
    }
  ],
  "canonicalSolutions": [
    {
      "language": "python",
      "code": "# Time:  O(1)\n# Space: O(1)\n\nimport pandas as pd\n\n\n# pandas\ndef selectFirstRows(employees: pd.DataFrame) -> pd.DataFrame:\n    return employees.head(3)",
      "timeComplexity": "",
      "spaceComplexity": ""
    }
  ],
  "editorial": {
    "approach": "",
    "explanation": "",
    "keyInsight": "",
    "commonMistakes": []
  }
}