{
  "id": "4ae21ea6-2d6d-4e77-af4f-720e0dc5f817",
  "slug": "maximum-matrix-sum",
  "title": "Maximum Matrix Sum",
  "difficulty": "medium",
  "descriptionHtml": "<p>You are given an <code>n x n</code> integer <code>matrix</code>. You can do the following operation <strong>any</strong> number of times:</p>\n\n<ul>\n\t<li>Choose any two <strong>adjacent</strong> elements of <code>matrix</code> and <strong>multiply</strong> each of them by <code>-1</code>.</li>\n</ul>\n\n<p>Two elements are considered <strong>adjacent</strong> if and only if they share a <strong>border</strong>.</p>\n\n<p>Your goal is to <strong>maximize</strong> the summation of the matrix&#39;s elements. Return <em>the <strong>maximum</strong> sum of the matrix&#39;s elements using the operation mentioned above.</em></p>\n\n<p>&nbsp;</p>\n<p><strong class=\"example\">Example 1:</strong></p>\n<img alt=\"\" src=\"https://assets.leetcode.com/uploads/2021/07/16/pc79-q2ex1.png\" style=\"width: 401px; height: 81px;\" />\n<pre>\n<strong>Input:</strong> matrix = [[1,-1],[-1,1]]\n<strong>Output:</strong> 4\n<b>Explanation:</b> We can follow the following steps to reach sum equals 4:\n- Multiply the 2 elements in the first row by -1.\n- Multiply the 2 elements in the first column by -1.\n</pre>\n\n<p><strong class=\"example\">Example 2:</strong></p>\n<img alt=\"\" src=\"https://assets.leetcode.com/uploads/2021/07/16/pc79-q2ex2.png\" style=\"width: 321px; height: 121px;\" />\n<pre>\n<strong>Input:</strong> matrix = [[1,2,3],[-1,-2,-3],[1,2,3]]\n<strong>Output:</strong> 16\n<b>Explanation:</b> We can follow the following step to reach sum equals 16:\n- Multiply the 2 last elements in the second row by -1.\n</pre>\n\n<p>&nbsp;</p>\n<p><strong>Constraints:</strong></p>\n\n<ul>\n\t<li><code>n == matrix.length == matrix[i].length</code></li>\n\t<li><code>2 &lt;= n &lt;= 250</code></li>\n\t<li><code>-10<sup>5</sup> &lt;= matrix[i][j] &lt;= 10<sup>5</sup></code></li>\n</ul>\n",
  "patterns": [
    "array",
    "greedy",
    "matrix"
  ],
  "constraints": {},
  "examples": [],
  "testCases": [],
  "canonicalSolutions": [
    {
      "language": "cpp",
      "code": "// Time:  O(n^2)\n// Space: O(1)\n\nclass Solution {\npublic:\n    long long maxMatrixSum(vector<vector<int>>& matrix) {\n        int64_t abs_total = 0, min_abs_val = numeric_limits<int64_t>::max();\n        bool is_neg_cnt_odd = false;\n        for (int i = 0; i < size(matrix); ++i) {\n            for (int j = 0; j < size(matrix[0]); ++j) {\n                abs_total += abs(matrix[i][j]);\n                min_abs_val = min(min_abs_val, labs(matrix[i][j]));\n                if (matrix[i][j] < 0) {\n                    is_neg_cnt_odd = !is_neg_cnt_odd;\n                }\n            }\n        }\n        return !is_neg_cnt_odd ? abs_total : abs_total - 2 * min_abs_val;\n    }\n};",
      "timeComplexity": "",
      "spaceComplexity": ""
    },
    {
      "language": "python",
      "code": "# Time:  O(n^2)\n# Space: O(1)\n\nclass Solution(object):\n    def maxMatrixSum(self, matrix):\n        \"\"\"\n        :type matrix: List[List[int]]\n        :rtype: int\n        \"\"\"\n        abs_total = sum(abs(x) for row in matrix for x in row)\n        min_abs_val = min(abs(x) for row in matrix for x in row)\n        neg_cnt = sum(x < 0 for row in matrix for x in row)\n        return abs_total if neg_cnt%2 == 0 else abs_total - 2*min_abs_val",
      "timeComplexity": "",
      "spaceComplexity": ""
    }
  ],
  "editorial": {
    "approach": "",
    "explanation": "",
    "keyInsight": "",
    "commonMistakes": []
  }
}