{
  "id": "95596d3a-58d8-4eb5-9536-50c5afd57e5a",
  "slug": "count-caesar-cipher-pairs",
  "title": "Count Caesar Cipher Pairs",
  "difficulty": "medium",
  "descriptionHtml": "<p>You are given an array <code>words</code> of <code>n</code> strings. Each string has length <code>m</code> and contains only lowercase English letters.</p>\n\n<p>Two strings <code>s</code> and <code>t</code> are <strong>similar</strong> if we can apply the following operation any number of times (possibly zero times) so that <code>s</code> and <code>t</code> become <strong>equal</strong>.</p>\n\n<ul>\n\t<li>Choose either <code>s</code> or <code>t</code>.</li>\n\t<li>Replace <strong>every</strong> letter in the chosen string with the next letter in the alphabet cyclically. The next letter after <code>&#39;z&#39;</code> is <code>&#39;a&#39;</code>.</li>\n</ul>\n\n<p>Count the number of pairs of indices <code>(i, j)</code> such that:</p>\n\n<ul>\n\t<li><code>i &lt; j</code></li>\n\t<li><code>words[i]</code> and <code>words[j]</code> are <strong>similar</strong>.</li>\n</ul>\n\n<p>Return an integer denoting the number of such pairs.</p>\n\n<p>&nbsp;</p>\n<p><strong class=\"example\">Example 1:</strong></p>\n\n<div class=\"example-block\">\n<p><strong>Input:</strong> <span class=\"example-io\">words = [&quot;fusion&quot;,&quot;layout&quot;]</span></p>\n\n<p><strong>Output:</strong> <span class=\"example-io\">1</span></p>\n\n<p><strong>Explanation:</strong></p>\n\n<p><code>words[0] = &quot;fusion&quot;</code> and <code>words[1] = &quot;layout&quot;</code> are similar because we can apply the operation to <code>&quot;fusion&quot;</code> 6 times. The string <code>&quot;fusion&quot;</code> changes as follows.</p>\n\n<ul>\n\t<li><code>&quot;fusion&quot;</code></li>\n\t<li><code>&quot;gvtjpo&quot;</code></li>\n\t<li><code>&quot;hwukqp&quot;</code></li>\n\t<li><code>&quot;ixvlrq&quot;</code></li>\n\t<li><code>&quot;jywmsr&quot;</code></li>\n\t<li><code>&quot;kzxnts&quot;</code></li>\n\t<li><code>&quot;layout&quot;</code></li>\n</ul>\n</div>\n\n<p><strong class=\"example\">Example 2:</strong></p>\n\n<div class=\"example-block\">\n<p><strong>Input:</strong> <span class=\"example-io\">words = [&quot;ab&quot;,&quot;aa&quot;,&quot;za&quot;,&quot;aa&quot;]</span></p>\n\n<p><strong>Output:</strong> <span class=\"example-io\">2</span></p>\n\n<p><strong>Explanation:</strong></p>\n\n<p><code>words[0] = &quot;ab&quot;</code> and <code>words[2] = &quot;za&quot;</code> are similar. <code>words[1] = &quot;aa&quot;</code> and <code>words[3] = &quot;aa&quot;</code> are similar.</p>\n</div>\n\n<p>&nbsp;</p>\n<p><strong>Constraints:</strong></p>\n\n<ul>\n\t<li><code>1 &lt;= n == words.length &lt;= 10<sup>5</sup></code></li>\n\t<li><code>1 &lt;= m == words[i].length &lt;= 10<sup>5</sup></code></li>\n\t<li><code>1 &lt;= n * m &lt;= 10<sup>5</sup></code></li>\n\t<li><code>words[i]</code> consists only of lowercase English letters.</li>\n</ul>\n",
  "patterns": [
    "array",
    "hash-table",
    "math",
    "string",
    "counting"
  ],
  "constraints": {},
  "examples": [],
  "testCases": [],
  "canonicalSolutions": [
    {
      "language": "cpp",
      "code": "// Time:  O(n * m)\n// Space: O(n * m)\n\n// freq table\nclass Solution {\npublic:\n    long long countPairs(vector<string>& words) {\n        const auto& f = [](auto s) {\n            for (int i = size(s) - 1; i >= 0; --i) {\n                s[i] = 'a' + ((s[i] - s[0]) % 26 + 26) % 26;\n            }\n            return s;\n        };\n\n        int64_t result = 0;\n        unordered_map<string, int> cnt;\n        for (const auto& w : words) {\n            result += cnt[f(w)]++;\n        }\n        return result;\n    }\n};",
      "timeComplexity": "",
      "spaceComplexity": ""
    },
    {
      "language": "python",
      "code": "# Time:  O(n * m)\n# Space: O(n * m)\n\nimport collections\n\n\n# freq table\nclass Solution(object):\n    def countPairs(self, words):\n        \"\"\"\n        :type words: List[str]\n        :rtype: int\n        \"\"\"\n        def f(s):\n            return \"\".join(chr(ord('a')+((ord(x)-ord(s[0]))%26)) for x in s)\n\n        result = 0\n        cnt = collections.defaultdict(int)\n        for w in words:\n            s = f(w)\n            result += cnt[s]\n            cnt[s] += 1\n        return result",
      "timeComplexity": "",
      "spaceComplexity": ""
    }
  ],
  "editorial": {
    "approach": "",
    "explanation": "",
    "keyInsight": "",
    "commonMistakes": []
  }
}